{
  "schema_version": "3.2.1",
  "rubric_version": "八维伪线性探针-v3.2.1",
  "task_id": "9c259ad8a7c5f1a133be",
  "source_sha256": "eb22d82f4bece7ecd03093315e80659567e8dfbb92511ca1af30925498ec4a12",
  "input_type": "single_chapter",
  "extractor": {
    "name": "Codex",
    "run_note": "按项目 CODEX_TASK.md 对授权导入第一章进行本地结构化提取"
  },
  "mainline": {
    "core_viewpoint": "秦牧",
    "current_goal": "在残老村长大并理解身边异常",
    "current_obstacle": "残老村的黑暗规则、村民隐藏的过去和母牛化人事件",
    "gained_or_lost": "获得秦牧身世、玉佩、残老村规则和司婆婆变人化牛能力等信息",
    "situation_change": "从婴儿被救的身世铺垫，推进到少年秦牧亲眼遭遇母牛化人和黑暗吞噬",
    "next_commitment": "黑暗里的东西、村民真实身份和秦牧能否学习司婆婆手段继续悬置",
    "one_sentence_mainline": "秦牧在残老村被一群残缺老人养大，第一次直面奶牛化人和村外黑暗后，对村庄规则与自身来历产生追问。",
    "readability_risk": "低",
    "missing_items": []
  },
  "axes": [
    {
      "axis": "因果代价轴",
      "evidence_sufficient": true,
      "score": 3,
      "confidence": 91,
      "overload_risk": "低",
      "evidence": [
        "马老连忙过去：“司老太婆，你疯了？天黑了，出了村就是死！”",
        "司婆婆瞥他一眼，道：“这女子是距离这儿千里外的镶龙城城主夫人，镶龙城主好色，而她善妒，镶龙城主喜欢在外面沾花惹草，强掠良家女子。而镶龙城主每坏了一个女子的清白，这位城主夫人便会派人将那女子活活打死。我潜入镶龙城，原本打算杀她，见到她刚刚生了一个孩子，孩子才三个月，又想到你还没有奶喝，而她有奶，于是将她变成一头奶牛回来奶你。只是没想到这女子竟然挣脱了封印，能够开口说话，差点就害了你。”"
      ],
      "judgment": "黑暗出村、救婴、饲养秦牧和变人化牛都带有直接生命风险或长期反噬，代价和收益绑定清晰。",
      "root_issue": "",
      "related_axes": [
        "设定动作化轴",
        "活人冲突轴"
      ],
      "evidence_gap": ""
    },
    {
      "axis": "期待违背轴",
      "evidence_sufficient": true,
      "score": 3,
      "confidence": 92,
      "overload_risk": "低",
      "evidence": [
        "牛皮剥到一半时，从里面滚出一个二三十岁的妇人，两条腿依旧包裹在牛腿中，皮肉与牛皮相连，不过上肢已经从牛皮中脱开。",
        "瘸子还是不紧不慢的往村子走，在他走入村子的一刹那，浓烈的黑暗正好将村子淹没。他背上的猎物是一头斑斓猛虎，还没有死，尾巴被黑暗扫中，突然猛虎发出一声哀吼，秦牧连忙看去，只见猛虎的尾巴竟然只剩下了一节节骨头，尾巴上的皮毛和血肉全都不见了，好像是被什么东西啃掉的一般。"
      ],
      "judgment": "奶牛内藏妇人、慈祥老人杀人、黑暗瞬间啃食猛虎尾巴，持续改变读者对村庄与老人身份的预测。",
      "root_issue": "",
      "related_axes": [
        "反差造梗轴",
        "设定动作化轴"
      ],
      "evidence_gap": ""
    },
    {
      "axis": "极速流转轴",
      "evidence_sufficient": true,
      "score": 3,
      "confidence": 88,
      "overload_risk": "中",
      "evidence": [
        "突然，司婆婆耳朵动了动，呆了呆，失声道：“你们听，外面有个孩子的哭声！”",
        "那女子披头散发，一把抢过已经吓呆了的秦牧手中的镰刀，两三下切开腿脚上的牛皮，看向秦牧，恶向胆边生，镰刀架在秦牧脖子上",
        "那女子正要一刀砍死他，突然后心一凉，低头看去，一口刀从她胸前穿出。"
      ],
      "judgment": "章节内多次快速切换目标与危险，从救婴、命名、成长到牛皮危机和黑暗压迫，信息流转密度高。",
      "root_issue": "",
      "related_axes": [
        "活人冲突轴"
      ],
      "evidence_gap": ""
    },
    {
      "axis": "章尾钩子轴",
      "evidence_sufficient": true,
      "score": 3,
      "confidence": 93,
      "overload_risk": "低",
      "evidence": [
        "他好奇的看了看村外的黑暗，那里漆黑一片，什么也看不到。",
        "“黑暗里到底有什么？”他心中纳闷。"
      ],
      "judgment": "结尾把已被动作证明有杀伤力的黑暗转化成主角追问，下一章有清晰探索承诺。",
      "root_issue": "",
      "related_axes": [
        "设定动作化轴"
      ],
      "evidence_gap": ""
    },
    {
      "axis": "活人冲突轴",
      "evidence_sufficient": true,
      "score": 3,
      "confidence": 89,
      "overload_risk": "中",
      "evidence": [
        "司婆婆大怒：“老娘凭本事捡到的小孩，为什么要送人？”",
        "那女子披头散发，一把抢过已经吓呆了的秦牧手中的镰刀，两三下切开腿脚上的牛皮，看向秦牧，恶向胆边生，镰刀架在秦牧脖子上",
        "“牧儿，你药师爷爷让你回去吃药了。”女子尸体倒下，身后站着的是村里的瘸子爷爷，慈眉善目，一脸憨厚，手里拎着一口血淋漓的刀，向秦牧笑道。"
      ],
      "judgment": "人物围绕救不救、养不养、杀不杀直接改变局势，冲突不是背景设定而是由角色选择推动。",
      "root_issue": "",
      "related_axes": [
        "因果代价轴",
        "反差造梗轴"
      ],
      "evidence_gap": ""
    },
    {
      "axis": "侧面烘托轴",
      "evidence_sufficient": true,
      "score": 3,
      "confidence": 86,
      "overload_risk": "低",
      "evidence": [
        "黑暗降临，四个石像在黑暗中散发出幽幽的光芒，石像依旧亮着，让司婆婆和村里的老者都松了口气。",
        "一众村民唯唯诺诺，不敢反驳她，村长坐着担架过来，他比其他人都要凄惨一些，其他人好歹也有手脚，只是比正常人少，而他则是无手无脚。不过大家对他都很是敬重，即便是凶神恶煞的司婆婆也是不敢放肆。"
      ],
      "judgment": "村民、村长、石像体系持续反衬规则压力和老人层级，配角反应有效支撑主线异常。",
      "root_issue": "",
      "related_axes": [
        "设定动作化轴"
      ],
      "evidence_gap": ""
    },
    {
      "axis": "反差造梗轴",
      "evidence_sufficient": true,
      "score": 3,
      "confidence": 87,
      "overload_risk": "中",
      "evidence": [
        "“牧儿，你药师爷爷让你回去吃药了。”女子尸体倒下，身后站着的是村里的瘸子爷爷，慈眉善目，一脸憨厚，手里拎着一口血淋漓的刀，向秦牧笑道。",
        "司婆婆笑道：“那是便宜了她。十一年前她就应该死了，如果不是要奶你，她能活到现在？”"
      ],
      "judgment": "慈眉善目的老人、养育日常和凶险手段形成强反差，并持续改变秦牧对亲近者的认知。",
      "root_issue": "",
      "related_axes": [
        "活人冲突轴",
        "期待违背轴"
      ],
      "evidence_gap": ""
    },
    {
      "axis": "设定动作化轴",
      "evidence_sufficient": true,
      "score": 4,
      "confidence": 94,
      "overload_risk": "中",
      "evidence": [
        "只见黑暗从西方缓缓的淹没过来，沿途吞噬山川河流道路树木，然后来到残老村，将残老村淹没。",
        "马老和司\r\n    婆婆走出残老村，黑暗中不知有什么古怪的东西围绕两人游走，但被石像的光芒一照，便吱吱怪叫退回黑暗之中。",
        "秦牧举起镰刀，小心翼翼割破牛皮，说来也怪牛皮被剥开，竟然没有一丝血流出，而且牛皮里面竟然是空的，没有血肉和骨架。"
      ],
      "judgment": "黑暗、石像、玉佩、封印化牛等设定几乎都通过行动和后果显形，是本章最强驱动项。",
      "root_issue": "",
      "related_axes": [
        "期待违背轴",
        "章尾钩子轴"
      ],
      "evidence_gap": ""
    }
  ],
  "gates": [
    {
      "gate": "卖点识别门",
      "evidence_sufficient": true,
      "score": 3,
      "confidence": 90,
      "evidence": [
        "天黑，别出门。Ｘ更新最快",
        "村里的石像会保护我们，黑暗里的东西不敢进入村子。"
      ],
      "judgment": "黑暗禁忌、石像庇护、残老村和秦牧身世构成可一句话识别的玄幻卖点。",
      "evidence_gap": ""
    },
    {
      "gate": "情绪承诺门",
      "evidence_sufficient": true,
      "score": 3,
      "confidence": 88,
      "evidence": [
        "秦牧瞠目结舌，失声道：“婆婆，人怎么能变成牛？”",
        "“黑暗里到底有什么？”他心中纳闷。"
      ],
      "judgment": "主要承诺是窥秘、惊奇和危险世界观揭露，情绪方向明确。",
      "evidence_gap": ""
    },
    {
      "gate": "开篇入口门",
      "evidence_sufficient": true,
      "score": 3,
      "confidence": 91,
      "evidence": [
        "天黑，别出门。Ｘ更新最快",
        "突然，司婆婆耳朵动了动，呆了呆，失声道：“你们听，外面有个孩子的哭声！”"
      ],
      "judgment": "开篇快速给出禁忌规则，并立刻用黑暗中的婴儿哭声制造具体麻烦。",
      "evidence_gap": ""
    },
    {
      "gate": "主角发动机门",
      "evidence_sufficient": true,
      "score": 2,
      "confidence": 82,
      "evidence": [
        "秦牧眨眨眼睛，试探道：“我如何救你？”",
        "秦牧瞠目结舌，失声道：“婆婆，人怎么能变成牛？”"
      ],
      "judgment": "秦牧已有好奇、善意和追问能力，但第一章主导行动仍多由司婆婆、瘸子等长辈承担。",
      "evidence_gap": ""
    },
    {
      "gate": "最小兑现门",
      "evidence_sufficient": true,
      "score": 3,
      "confidence": 89,
      "evidence": [
        "秦牧举起镰刀，小心翼翼割破牛皮，说来也怪牛皮被剥开，竟然没有一丝血流出，而且牛皮里面竟然是空的，没有血肉和骨架。",
        "司婆婆嘿嘿一笑，露出半嘴零落牙齿：“你想学？我教你……瘸子回来了！”"
      ],
      "judgment": "本章兑现了黑暗规则、化牛反转和主角可学习异术的单位，具备后续重复生产空间。",
      "evidence_gap": ""
    },
    {
      "gate": "连载扩展门",
      "evidence_sufficient": true,
      "score": 3,
      "confidence": 87,
      "evidence": [
        "玉佩上有字，是个秦字。这块\r\n    玉佩没有杂质，里面还有奇怪的力量，不是凡品，应该是出自大户人家吧？",
        "司婆婆瞥他一眼，道：“这女子是距离这儿千里外的镶龙城城主夫人，镶龙城主好色，而她善妒，镶龙城主喜欢在外面沾花惹草，强掠良家女子。而镶龙城主每坏了一个女子的清白，这位城主夫人便会派人将那女子活活打死。我潜入镶龙城，原本打算杀她，见到她刚刚生了一个孩子，孩子才三个月，又想到你还没有奶喝，而她有奶，于是将她变成一头奶牛回来奶你。只是没想到这女子竟然挣脱了封印，能够开口说话，差点就害了你。”"
      ],
      "judgment": "秦姓玉佩、镶龙城、村外黑暗和老人能力都能扩展出身世、地图、敌对势力和修行体系。",
      "evidence_gap": ""
    }
  ],
  "top_issues": [
    {
      "issue_id": "P01",
      "primary_axis": "活人冲突轴",
      "related_axes": [
        "极速流转轴"
      ],
      "location": "秦牧少年线",
      "evidence": "秦牧眨眨眼睛，试探道：“我如何救你？”",
      "root_cause": "秦牧作为本章名义主角，主动目标仍偏弱，关键破局由瘸子和司婆婆完成。",
      "commercial_damage": "读者已看见强世界观，但对主角长期行动模式的抓手略晚。",
      "minimum_change": "在不改变剧情的前提下，增加秦牧主动试探黑暗、玉佩或村规的一次小选择。"
    },
    {
      "issue_id": "P02",
      "primary_axis": "极速流转轴",
      "related_axes": [
        "期待违背轴"
      ],
      "location": "开篇救婴到十一年后转场",
      "evidence": "这少年正是十一年前司婆婆从江边捡来的婴儿，这些年来村里的老人含辛茹苦将这孩子养大，司婆婆不知从哪儿弄来一头母牛，让婴儿时的秦牧每天喝牛奶，熬过了容易早夭的时期。",
      "root_cause": "婴儿获救、命名和十一年成长之间跳转很快，信息密度高。",
      "commercial_damage": "强设定不断出现时，少量读者可能需要更多情绪落点来稳定代入秦牧。",
      "minimum_change": "保留快节奏，只在转场前后补一处秦牧与司婆婆的情感锚点。"
    }
  ],
  "evidence_gaps": [],
  "extraction_confidence": 89
}
