{
  "schema_version": "3.2.1",
  "rubric_version": "八维伪线性探针-v3.2.1",
  "task_id": "0f21de8093eefe20165f",
  "source_sha256": "072d24ec37574df1361b7f2eff2084d8057b644061b500e51a0793f1eb9e6dd9",
  "input_type": "single_chapter",
  "extractor": {
    "name": "Codex-example",
    "run_note": "包内可复现人工结构化示例"
  },
  "mainline": {
    "core_viewpoint": "沈砚",
    "current_goal": "拒绝认债并夺取主动权",
    "current_obstacle": "掌柜、伙计和认债规则共同封锁",
    "gained_or_lost": "烧毁清白证据，得到看见债痕的能力并背负全城心跳",
    "situation_change": "掌柜罪证显形，巡夜人转向，当铺出现地下入口",
    "next_commitment": "石阶下的第一笔债已经到期",
    "one_sentence_mainline": "沈砚烧毁账簿拒绝认债，以新代价反制掌柜并打开未知债窟。",
    "readability_risk": "低",
    "missing_items": []
  },
  "axes": [
    {
      "axis": "因果代价轴",
      "evidence_sufficient": true,
      "score": 4,
      "confidence": 94,
      "overload_risk": "中",
      "evidence": [
        "他得到看见债痕的能力，却也听见全城欠债人的心跳。"
      ],
      "judgment": "能力收益与持续负担同步建立。",
      "root_issue": "",
      "related_axes": [],
      "evidence_gap": ""
    },
    {
      "axis": "期待违背轴",
      "evidence_sufficient": true,
      "score": 4,
      "confidence": 93,
      "overload_risk": "中",
      "evidence": [
        "沈砚没有接笔，而是把袖里的火折子按进账簿。"
      ],
      "judgment": "拒绝常规签字路径，并改变后续证据状态。",
      "root_issue": "",
      "related_axes": [],
      "evidence_gap": ""
    },
    {
      "axis": "极速流转轴",
      "evidence_sufficient": true,
      "score": 4,
      "confidence": 92,
      "overload_risk": "中",
      "evidence": [
        "掌柜欠下的三条人命同时在墙上显形，门外巡夜人看见血字，第一次拔刀指向当铺。"
      ],
      "judgment": "信息、权力与阵营在同一动作中连续变化。",
      "root_issue": "",
      "related_axes": [],
      "evidence_gap": ""
    },
    {
      "axis": "章尾钩子轴",
      "evidence_sufficient": true,
      "score": 4,
      "confidence": 95,
      "overload_risk": "低",
      "evidence": [
        "阶下有人用他的声音说：“第一笔债，已经到期。”"
      ],
      "judgment": "启动不可无成本搁置且可在下一章兑现的承诺。",
      "root_issue": "",
      "related_axes": [],
      "evidence_gap": ""
    },
    {
      "axis": "活人冲突轴",
      "evidence_sufficient": true,
      "score": 4,
      "confidence": 94,
      "overload_risk": "中",
      "evidence": [
        "掌柜扑来抢他的手，沈砚反扣住对方手腕，把新出现的债痕按在火上。"
      ],
      "judgment": "双方围绕债痕控制权主动改变局势。",
      "root_issue": "",
      "related_axes": [],
      "evidence_gap": ""
    },
    {
      "axis": "侧面烘托轴",
      "evidence_sufficient": true,
      "score": 3,
      "confidence": 90,
      "overload_risk": "低",
      "evidence": [
        "一直缩在角落的小伙计忽然跪下，喊沈砚“新掌柜”。"
      ],
      "judgment": "配角因主角行动改变身份判断与立场。",
      "root_issue": "",
      "related_axes": [],
      "evidence_gap": ""
    },
    {
      "axis": "反差造梗轴",
      "evidence_sufficient": true,
      "score": 3,
      "confidence": 89,
      "overload_risk": "低",
      "evidence": [
        "沈砚平日连讨价还价都嫌麻烦，此刻却把烧红的铜秤挂回腰间：“这家店，我先赊走。”"
      ],
      "judgment": "稳定性格与极端行动形成可记忆反差，并夺取资源。",
      "root_issue": "",
      "related_axes": [],
      "evidence_gap": ""
    },
    {
      "axis": "设定动作化轴",
      "evidence_sufficient": true,
      "score": 4,
      "confidence": 93,
      "overload_risk": "中",
      "evidence": [
        "镜中没有他的倒影，只有一枚黑印从裂缝里钻出，钉进他的手腕。"
      ],
      "judgment": "规则由动作与身体后果直接呈现。",
      "root_issue": "",
      "related_axes": [],
      "evidence_gap": ""
    }
  ],
  "gates": [
    {
      "gate": "卖点识别门",
      "evidence_sufficient": true,
      "score": 4,
      "confidence": 94,
      "evidence": [
        "火焰吞掉欠条，也烧掉了能证明他清白的唯一账页。"
      ],
      "judgment": "欠债规则、能力与代价形成不可替代卖点。",
      "evidence_gap": ""
    },
    {
      "gate": "情绪承诺门",
      "evidence_sufficient": true,
      "score": 4,
      "confidence": 93,
      "evidence": [
        "掌柜欠下的三条人命同时在墙上显形"
      ],
      "judgment": "提供压迫、反制和窥秘复合情绪。",
      "evidence_gap": ""
    },
    {
      "gate": "开篇入口门",
      "evidence_sufficient": true,
      "score": 3,
      "confidence": 92,
      "evidence": [
        "城南当铺关门时，沈砚收到一张写着自己死期的欠条。"
      ],
      "judgment": "首句仍直接建立异常与迫近风险。",
      "evidence_gap": ""
    },
    {
      "gate": "主角发动机门",
      "evidence_sufficient": true,
      "score": 4,
      "confidence": 94,
      "evidence": [
        "沈砚没有接笔，而是把袖里的火折子按进账簿。"
      ],
      "judgment": "主角以拒绝受控和主动掀桌作为稳定行动方式。",
      "evidence_gap": ""
    },
    {
      "gate": "最小兑现门",
      "evidence_sufficient": true,
      "score": 4,
      "confidence": 93,
      "evidence": [
        "门外巡夜人看见血字，第一次拔刀指向当铺。"
      ],
      "judgment": "完成一次可重复的揭债反制兑现。",
      "evidence_gap": ""
    },
    {
      "gate": "连载扩展门",
      "evidence_sufficient": true,
      "score": 4,
      "confidence": 91,
      "evidence": [
        "他得到看见债痕的能力，却也听见全城欠债人的心跳。"
      ],
      "judgment": "债务对象可扩展到全城，代价和案件均可升级。",
      "evidence_gap": ""
    }
  ],
  "top_issues": [],
  "evidence_gaps": [],
  "extraction_confidence": 93
}
